Kood;Lühinimetus;Nimetus;Pikk_nimetus;Vanem_kood;Hierarhia_aste;Kehtivuse_alguse_kpv;Kehtivuse_lõpu_kpv;Viimane_muudatus_kpv;Muutja;Staatus;Selgitus
M1;nibustaadium;vaid rinnanibu on tõusnud;vaid rinnanibu on tõusnud;;;31.05.2007;;;;1;
M2;nupustaadium;nn nupustaadium: rind ja rinnanibu on kergelt tõusnud, näärmekude on palpeeritav, areool on suurenenud;nn nupustaadium: rind ja rinnanibu on kergelt tõusnud, näärmekude on palpeeritav, areool on suurenenud;;;31.05.2007;;;;1;
M3;suurenenud nupu staadium;rind ja areool on veelgi suurenenud, nende äärejoon moodustab küljelt vaadatuna kaare;rind ja areool on veelgi suurenenud, nende äärejoon moodustab küljelt vaadatuna kaare;;;31.05.2007;;;;1;
M4;kühmustaadium;areool tõuseb ja moodustab kühmu;areool tõuseb ja moodustab kühmu;;;31.05.2007;;;;1;
M5;küps rind;küps rind - ainult rinnanibu eraldub rinnast, areool on tasapinnaline;küps rind - ainult rinnanibu eraldub rinnast, areool on tasapinnaline;;;31.05.2007;;;;1;
