Kood;Lühinimetus;Nimetus;Pikk_nimetus;Vanem_kood;Hierarhia_aste;Kehtivuse_alguse_kpv;Kehtivuse_lõpu_kpv;Viimane_muudatus_kpv;Muutja;Staatus;Selgitus
016;;SARS-CoV-2 RNA positiivne tulemus;;;0;25.01.2021;;;ELMÜ;1;
028;;Läbipõetud hingamisteede nakkus negatiivse RNA tulemusega;;;0;25.01.2021;;;ELMÜ;1;
049;;Läbipõetud hingamisteede nakkus ilma RNA analüüsita;;;0;25.01.2021;;;ELMÜ;1;
057;;Kahtlus COVID-19 asümptomaatilisele põdemisele;;;0;25.01.2021;;;ELMÜ;1;
070;;Vaktsineerimisjärgne kontroll;;;0;25.01.2021;;;ELMÜ;1;
100;;Teadmata;;;0;25.01.2021;;;ELMÜ;1;
