Kood;Lühinimetus;Nimetus;Pikk_nimetus;Vanem_kood;Hierarhia_aste;Kehtivuse_alguse_kpv;Kehtivuse_lõpu_kpv;Viimane_muudatus_kpv;Muutja;Staatus;Selgitus
PARENTAL_CONTAGION_HEMO_BLOODTRANSFER;hemofiiliahaige nakatumine verekomponentide ülekande kaudu;hemofiiliahaige nakatumine verekomponentide ülekande kaudu;hemofiiliahaige nakatumine verekomponentide ülekande kaudu;;;1.01.2011;;;Terviseamet;1;
PARENTAL_CONTAGION_MEDPROCEDURE;meditsiiniline protseduur, mille käigus katkes kudede terviklikkus;meditsiiniline protseduur, mille käigus katkes kudede terviklikkus;meditsiiniline protseduur, mille käigus katkes kudede terviklikkus;;;1.01.2011;;;Terviseamet;1;
PARENTAL_CONTAGION_BLOODTRANSFER;vere/verekomponentide/plasma ülekanne (va hemofiiliahaige);vere/verekomponentide/plasma ülekanne (va hemofiiliahaige);vere/verekomponentide/plasma ülekanne (va hemofiiliahaige);;;1.01.2011;;;Terviseamet;1;
PARENTAL_CONTAGION_INJECT;ühise süstimisvarustuse/süsteaine kasutus;ühise süstimisvarustuse/süsteaine kasutus;ühise süstimisvarustuse/süsteaine kasutus;;;1.01.2011;;;Terviseamet;1;
PARENTAL_CONTAGION_OTHER;muu  (kirjutada);muu  (kirjutada);muu  (kirjutada);;;1.01.2011;;;Terviseamet;1;
