388604008;;Villiit;Villitis (disorder);;0;19.12.2016;;;Eesti Patoloogide Selts;1;Asendab kehtetuks tunnistatud väärtust 388602007 Villitis of unknown etiology (disorder);
7231009;;Villiline dermatoos;Bullous dermatosis (disorder);;0;19.12.2016;;;Eesti Patoloogide Selts;1;;
6111009;;Villiline lame lihhen;Bullous lichen planus (disorder);;0;19.12.2016;;;Eesti Patoloogide Selts;1;;
703551008;;Villoglandulaarne kartsinoom;Villoglandular carcinoma (morphologic abnormality);;0;19.12.2016;;;Eesti Patoloogide Selts;1;;
95412009;;Villonodulaarne pigmenteerunud sünoviit;Pigmented villonodular synovitis (disorder);;0;19.12.2016;;;Eesti Patoloogide Selts;1;;
28558000;;Villoosne adenokartsinoom;Villous adenocarcinoma (morphologic abnormality);;0;19.12.2016;;;Eesti Patoloogide Selts;1;;4- vähk
128859003;;Villoosne adenoom;Villous adenoma (morphologic abnormality);;0;19.12.2016;;;Eesti Patoloogide Selts;1;;
445271007;;Villoosne artriit;Villous arthritis (disorder);;0;19.12.2016;;;Eesti Patoloogide Selts;1;;
77090002;;Villpemfigoid;Bullous pemphigoid (disorder);;0;19.12.2016;;;Eesti Patoloogide Selts;1;;
88518009;;Wilsoni tõbi;Wilson's disease (disorder);;0;19.12.2016;;;Eesti Patoloogide Selts;1;;
28543008;;Vistseromegaalia;Visceromegaly (morphologic abnormality);;0;19.12.2016;;;Eesti Patoloogide Selts;1;;
56727007;;Vitiliigo;Vitiligo (disorder);;0;19.12.2016;;;Eesti Patoloogide Selts;1;;
40641007;;Voldiline tuum;Folded nucleus (morphologic abnormality);;0;19.12.2016;;;Eesti Patoloogide Selts;1;;
204921008;;Wolffi juha tsüst;Cyst of Wolffian duct (disorder);;0;19.12.2016;;;Eesti Patoloogide Selts;1;;
413269001;;Võlvumine;Bulging (morphologic abnormality);;0;19.12.2016;;;Eesti Patoloogide Selts;1;;
19227008;;Võõrkeha;Foreign body (morphologic abnormality);;0;19.12.2016;;;Eesti Patoloogide Selts;1;;
37058002;;Võõrkeha granuloom;Foreign body giant cell granuloma (morphologic abnormality);;0;19.12.2016;;;Eesti Patoloogide Selts;1;;1- kasvajat ei ole
449763003;;Võõrkeha põhjustatud gingiviit;Foreign body gingivitis (disorder);;0;19.12.2016;;;Eesti Patoloogide Selts;1;;
112646004;;Võõrkehaembol;Foreign body embolus (morphologic abnormality);;0;19.12.2016;;;Eesti Patoloogide Selts;1;;
24398007;;Vähenenud tuuma/tsütoplasma suhe;Nuclear/cytoplasmic ratio decreased (morphologic abnormality);;0;19.12.2016;;;Eesti Patoloogide Selts;1;;
239932005;;Vähese immunoglobuliinide ladestusega nekrotiseeruv poolkuude tekkega glomerulonefriit;Primary pauci-immune necrotizing and crescentic glomerulonephritis (disorder);;0;19.12.2016;;;Eesti Patoloogide Selts;1;;
128881008;;Väike kongenitaalne neevus;Small congenital nevus (morphologic abnormality);;0;19.12.2016;30.09.2019;;Eesti Patoloogide Selts;0;Tunnistatud kehtetuks, seda asendab 398696001 Congenital pigmented melanocytic nevus (disorder);
289264006;;Väike platsenta;Small placenta (finding);;0;19.12.2016;30.05.2023;;Eesti Patoloogide Selts;0;Tunnistatud kehtetuks, seda asendab 1236952000 Placental volume below reference range (finding);
128791005;;Väikeaju düsplastiline gangliotsütoom (Lhermitte-Duclos' haigus);Dysplastic gangliocytoma of cerebellum (Lhermitte-Duclos) (morphologic abnormality);;0;19.12.2016;;;Eesti Patoloogide Selts;1;;
109763004;;Väikeste süljenäärmete adenomatoidne hüperplaasia;Adenomatoid hyperplasia of minor salivary gland (disorder);;0;19.12.2016;;;Eesti Patoloogide Selts;1;;
74364000;;Väikserakuline kartsinoom;Small cell carcinoma (morphologic abnormality);;0;19.12.2016;;;Eesti Patoloogide Selts;1;;4- vähk
703549009;;Väikserakuline kartsinoom, hüperkaltseemiline tüüp;Small cell carcinoma, hypercalcemic type (morphologic abnormality);;0;19.12.2016;;;Eesti Patoloogide Selts;1;;4- vähk
48554007;;Enterokromafiinrakuline kartsinoid;Enterochromaffin cell carcinoid (morphologic abnormality);;0;19.12.2016;;28.04.2020;Eesti Patoloogide Selts;1;Muudetud eestikeelne nimetus: Väikserakuline kartsinoom, neuroendokriinne tüüp-> Enterokromafiinrakuline kartsinoid;4- vähk
35718007;;Väikserakuline mittesarvestuv lamerakuline kartsinoom;Squamous cell carcinoma, small cell, nonkeratinizing (morphologic abnormality);;0;19.12.2016;;;Eesti Patoloogide Selts;1;;
200446013;;Väikserakuline neuroendokriinne kartsinoom, G3;Small cell neuroendocrine carcinoma;;0;19.12.2016;30.09.2019;;Eesti Patoloogide Selts;0;;
12302002;;Väikserakuline osteosarkoom;Small cell osteosarcoma (morphologic abnormality);;0;19.12.2016;;;Eesti Patoloogide Selts;1;;
73506006;;Diferentseerumata ümararakuline sarkoom;Small cell sarcoma (morphologic abnormality);;0;19.12.2016;;30.09.2019;Eesti Patoloogide Selts;1;Muudetud veerus nimetus: Väikserakuline sarkoom -> Diferentseerumata ümararakuline sarkoom;
21861000;;Väiksesõlmeline maksatsirroos;Micronodular cirrhosis (disorder);;0;19.12.2016;;;Eesti Patoloogide Selts;1;;
103657005;;Vöötlihasrakkude atüüpia;Striated muscle cell atypia (morphologic abnormality);;0;19.12.2016;;;Eesti Patoloogide Selts;1;;
36207003;;Õhkembol;Air embolus (morphologic abnormality);;0;19.12.2016;;;Eesti Patoloogide Selts;1;;
116034001;;Äge abstsess;Acute abscess (morphologic abnormality);;0;19.12.2016;;;Eesti Patoloogide Selts;1;;1- kasvajat ei ole
9953008;;Äge alkohoolne maksahaigus;Acute alcoholic liver disease (disorder);;0;19.12.2016;;;Eesti Patoloogide Selts;1;;
235942001;;Äge alkohoolne pankreatiit;Alcohol-induced acute pancreatitis (disorder);;0;19.12.2016;;;Eesti Patoloogide Selts;1;;
197410004;;Äge angiokoletsüstiit;Acute angiocholecystitis (disorder);;0;19.12.2016;;;Eesti Patoloogide Selts;1;;
85189001;;Äge apenditsiit;Acute appendicitis (disorder);;0;19.12.2016;;;Eesti Patoloogide Selts;1;;
111286002;;Äge bakteriaalne endokardiit;Acute bacterial endocarditis (disorder);;0;19.12.2016;;;Eesti Patoloogide Selts;1;;
69077002;;Äge basofiilleukeemia;Acute basophilic leukemia (morphologic abnormality);;0;19.12.2016;;;Eesti Patoloogide Selts;1;;
24072005;;Äge diferentseerumata leukeemia;Acute leukemia (morphologic abnormality);;0;19.12.2016;;31.05.2022;Eesti Patoloogide Selts;1;Korrigeeritud SNOMED CT FSN: Acute leukemia, morphology, including blast cell OR undifferentiated leukemia (morphologic abnormality) -> Acute leukemia (morphologic abnormality);
62312006;;Äge eksudatiivne põletik;Acute exudative inflammation (morphologic abnormality);;0;19.12.2016;;;Eesti Patoloogide Selts;1;;1- kasvajat ei ole
32067005;;Äge emfüsematoosne koletsüstiit;Acute emphysematous cholecystitis (disorder);;0;19.12.2016;;;Eesti Patoloogide Selts;1;;
19365003;;Äge empüeem;Acute empyema (morphologic abnormality);;0;19.12.2016;;;Eesti Patoloogide Selts;1;;1- kasvajat ei ole
444926003;;Äge erosiivne gastriit;Acute erosive gastritis (disorder);;0;19.12.2016;;;Eesti Patoloogide Selts;1;;
14317002;;Äge erütroidleukeemia;Acute myeloid leukemia, M6 type (morphologic abnormality);;0;19.12.2016;;;Eesti Patoloogide Selts;1;;
396217007;;Äge fibrinoosmädane põletik;Acute fibrinopurulent inflammation (morphologic abnormality);;0;19.12.2016;;;Eesti Patoloogide Selts;1;;1- kasvajat ei ole
45042004;;Äge fulminantne viirushepatiit;Acute fulminating viral hepatitis (disorder);;0;19.12.2016;;;Eesti Patoloogide Selts;1;;
25458004;;Äge gastriit;Acute gastritis (disorder);;0;19.12.2016;;;Eesti Patoloogide Selts;1;;
26317001;;Äge haavand;Acute ulcer (morphologic abnormality);;0;19.12.2016;;;Eesti Patoloogide Selts;1;;
40977003;;Äge haavanduv põletik;Acute ulcerative inflammation (morphologic abnormality);;0;19.12.2016;;;Eesti Patoloogide Selts;1;;1- kasvajat ei ole
2367005;;Äge hemorraagiline gastriit;Acute hemorrhagic gastritis (disorder);;0;19.12.2016;;;Eesti Patoloogide Selts;1;;
48413001;;Äge hemorraagiline koletsüstiit;Acute hemorrhagic cholecystitis (disorder);;0;19.12.2016;;;Eesti Patoloogide Selts;1;;
4399003;;Äge hemorraagiline pankreatiit;Acute hemorrhagic pancreatitis (disorder);;0;19.12.2016;;;Eesti Patoloogide Selts;1;;
43865008;;Äge hemorraagiline põletik;Acute hemorrhagic inflammation (morphologic abnormality);;0;19.12.2016;;;Eesti Patoloogide Selts;1;;1- kasvajat ei ole
37871000;;Äge hepatiit;Acute hepatitis (disorder);;0;19.12.2016;;;Eesti Patoloogide Selts;1;;
707167006;;Äge hulgiatsinaarne maksanekroos;Acute multi-acinar necrosis of liver (disorder);;0;19.12.2016;;;Eesti Patoloogide Selts;1;;
82479004;;Äge hüpereemia;Active congestion (morphologic abnormality);;0;19.12.2016;;;Eesti Patoloogide Selts;1;;
125521000;;Äge hüpertroofia;Acute hypertrophy (morphologic abnormality);;0;19.12.2016;;;Eesti Patoloogide Selts;1;;
55470003;;Äge infarkt;Acute infarct (morphologic abnormality);;0;19.12.2016;;;Eesti Patoloogide Selts;1;;
236302005;;Äge interstitsiaalne pneumoonia;Acute interstitial pneumonia (disorder);;0;19.12.2016;;;Eesti Patoloogide Selts;1;;
123732004;;Äge kiiritushaavand;Acute radiation ulcer (morphologic abnormality);;0;19.12.2016;;;Eesti Patoloogide Selts;1;;
6215006;;Äge kolangiit;Acute cholangitis (disorder);;0;19.12.2016;;;Eesti Patoloogide Selts;1;;
370490006;;Äge kolangiohepatiit;Acute cholangiohepatitis (disorder);;0;19.12.2016;;;Eesti Patoloogide Selts;1;;
123603008;;Äge koldeline hepatiit;Acute focal hepatitis (disorder);;0;19.12.2016;;;Eesti Patoloogide Selts;1;;
65275009;;Äge koletsüstiit;Acute cholecystitis (disorder);;0;19.12.2016;;;Eesti Patoloogide Selts;1;;
704175009;;Äge koorioamnioniit;Acute chorioamnionitis (disorder);;0;19.12.2016;;;Eesti Patoloogide Selts;1;;
315345002;;Äge kopsukahjustus;Acute lung injury (disorder);;0;19.12.2016;;;Eesti Patoloogide Selts;1;;
86487001;;Äge lihhenoidne ja rõugjas kliiketendustõbi;Acute lichenoid pityriasis (disorder);;0;19.12.2016;;;Eesti Patoloogide Selts;1;;
25979007;;Äge limane põletik;Acute mucous inflammation (morphologic abnormality);;0;19.12.2016;;;Eesti Patoloogide Selts;1;;1- kasvajat ei ole
41174002;;Äge lümfadeniit;Acute lymphadenitis (disorder);;0;19.12.2016;;;Eesti Patoloogide Selts;1;;
197269008;;Äge maksanekroos;Acute necrosis of liver (disorder);;0;19.12.2016;;;Eesti Patoloogide Selts;1;;
68272006;;Äge maksillaarsinusiit;Acute maxillary sinusitis (disorder);;0;19.12.2016;;;Eesti Patoloogide Selts;1;;
82789004;;Äge mastiit;Acute mastitis (disorder);;0;19.12.2016;;;Eesti Patoloogide Selts;1;;
52220008;;Äge megakarüoblastleukeemia;Acute megakaryoblastic leukemia, morphology (morphologic abnormality);;0;19.12.2016;;;Eesti Patoloogide Selts;1;;
18498000;;Äge membranoosne põletik;Acute membranous inflammation (morphologic abnormality);;0;19.12.2016;;;Eesti Patoloogide Selts;1;;1- kasvajat ei ole
406585009;;Äge mitte-A, mitte-B, mitte-C hepatiit;Acute non-A, non-B, non-C hepatitis (disorder);;0;19.12.2016;30.09.2019;;Eesti Patoloogide Selts;0;Tunnistatud kehtetuks, seda asendab 57412004 Acute viral hepatitis (disorder);
197271008;;Äge mittenakkuslik hepatiit;Acute hepatitis - non-infective (disorder);;0;19.12.2016;;;Eesti Patoloogide Selts;1;;
703818007;;Äge monoblast- ja monotsüütleukeemia;Acute monoblastic and monocytic leukemia (morphologic abnormality);;0;19.12.2016;;;Eesti Patoloogide Selts;1;;
89628003;;Äge mädane koletsüstiit;Acute suppurative cholecystitis (disorder);;0;19.12.2016;;;Eesti Patoloogide Selts;1;;
45959006;;Äge mädane põletik;Acute suppurative inflammation (morphologic abnormality);;0;19.12.2016;;;Eesti Patoloogide Selts;1;;1- kasvajat ei ole
17788007;;Äge müeloidleukeemia, teisiti täpsustamata;Acute myeloid leukemia, no International Classification of Diseases for Oncology subtype (morphologic abnormality);;0;19.12.2016;31.05.2022;;Eesti Patoloogide Selts;0;Tunnistatud kehtetuks, seda asendab 1162928000 Acute myeloid leukemia (morphologic abnormality);
30962008;;Äge müelomonotsüütleukeemia;Acute myelomonocytic leukemia (morphologic abnormality);;0;19.12.2016;;;Eesti Patoloogide Selts;1;;
7881005;;Äge nekrotiseeruv pankreatiit;Acute necrotizing pancreatitis (disorder);;0;19.12.2016;;;Eesti Patoloogide Selts;1;;
71877001;;Äge nekrotiseeruv põletik;Acute necrotizing inflammation (morphologic abnormality);;0;19.12.2016;;;Eesti Patoloogide Selts;1;;1- kasvajat ei ole
16486000;;Äge ooforiit;Acute oophoritis (disorder);;0;19.12.2016;;;Eesti Patoloogide Selts;1;;
409780002;;Äge osteomüeliit;Acute osteomyelitis (disorder);;0;19.12.2016;;;Eesti Patoloogide Selts;1;;1- kasvajat ei ole
197456007;;Äge pankreatiit;Acute pancreatitis (disorder);;0;19.12.2016;;;Eesti Patoloogide Selts;1;;
80570006;;Äge panmüeloos müelofibroosiga;Acute panmyelosis with myelofibrosis (morphologic abnormality);;0;19.12.2016;;;Eesti Patoloogide Selts;1;;
196682000;;Äge peptiline haavand;Acute peptic ulcer (disorder);;0;19.12.2016;;;Eesti Patoloogide Selts;1;;
67602004;;Äge peritoniit;Acute peritonitis (disorder);;0;19.12.2016;;;Eesti Patoloogide Selts;1;;
123747008;;Äge proliferatiivne põletik;Acute proliferative inflammation (morphologic abnormality);;0;19.12.2016;;;Eesti Patoloogide Selts;1;;1- kasvajat ei ole
28950004;;Äge promüelotsüütleukeemia, PML-RARA;"Acute promyelocytic leukemia, t(15;17)(q22;q11-12) (morphologic abnormality)";;0;19.12.2016;;29.11.2018;Eesti Patoloogide Selts;1;"Korrigeeritud eestikeelset nimetust: Äge promüelotsüütleukeemia, t(15;17)(q22;q21); PML-RARA -> Äge promüelotsüütleukeemia, PML-RARA";
79411002;;Äge prostatiit;Acute prostatitis (disorder);;0;19.12.2016;;;Eesti Patoloogide Selts;1;;
89282006;;Äge pseudomembranoosne põletik;Acute pseudomembranous inflammation (morphologic abnormality);;0;19.12.2016;;;Eesti Patoloogide Selts;1;;1- kasvajat ei ole
4532008;;Äge põletik;Acute inflammation (morphologic abnormality);;0;19.12.2016;;;Eesti Patoloogide Selts;1;;1- kasvajat ei ole
36689008;;Äge püelonefriit;Acute pyelonephritis (disorder);;0;19.12.2016;;;Eesti Patoloogide Selts;1;;
235944000;;Äge ravimitekkeline pankreatiit;Drug-induced acute pancreatitis (disorder);;0;19.12.2016;;;Eesti Patoloogide Selts;1;;
431231008;;Äge rinosinusiit;Acute rhinosinusitis (disorder);;0;19.12.2016;;;Eesti Patoloogide Selts;1;;
8912009;;Äge salpingiit;Acute salpingitis (disorder);;0;19.12.2016;;;Eesti Patoloogide Selts;1;;
396219005;;Äge serofibrinoosne põletik;Acute serofibrinous inflammation (morphologic abnormality);;0;19.12.2016;;;Eesti Patoloogide Selts;1;;1- kasvajat ei ole
58898007;;Äge seroosne põletik;Acute serous inflammation (morphologic abnormality);;0;19.12.2016;;;Eesti Patoloogide Selts;1;;1- kasvajat ei ole
38800000;;Äge seroosne sünoviit;Acute serous synovitis (disorder);;0;19.12.2016;;;Eesti Patoloogide Selts;1;;
109764005;;Äge sialoadeniit;Acute sialoadenitis (disorder);;0;19.12.2016;;;Eesti Patoloogide Selts;1;;
15805002;;Äge sinusiit;Acute sinusitis (disorder);;0;19.12.2016;;;Eesti Patoloogide Selts;1;;
4896000;;Äge toksiline hepatiit;Acute toxic hepatitis (disorder);;0;19.12.2016;;;Eesti Patoloogide Selts;1;Asendab kehtetuks tunnistatud väärtust 197358007 Toxic liver disease with acute hepatitis (disorder);
90176007;;Äge tonsilliit;Tonsillitis (disorder);;0;19.12.2016;;29.11.2018;Eesti Patoloogide Selts;1;Korrigeeritud SNOMED CT FSN: Acute tonsillitis (disorder)  -> Tonsillitis (disorder);
28637003;;Äge tubulointerstitsiaalne nefriit;Acute tubulointerstitial nephritis (disorder);;0;19.12.2016;;31.05.2022;Eesti Patoloogide Selts;1;Korrigeeritud SNOMED CT FSN: Acute interstitial nephritis (disorder) -> Acute tubulointerstitial nephritis (disorder);
35455006;;Äge tubulonekroos;Acute tubular necrosis (disorder);;0;19.12.2016;;;Eesti Patoloogide Selts;1;;
190293001;;Äge türeoidiit;Acute thyroiditis (disorder);;0;19.12.2016;;;Eesti Patoloogide Selts;1;;
24520005;;Äge vaginiit;Acute vaginitis (disorder);;0;19.12.2016;;;Eesti Patoloogide Selts;1;;
57412004;;Äge viirushepatiit;Acute viral hepatitis (disorder);;0;19.12.2016;;;Eesti Patoloogide Selts;1;;
409656006;;Äge ösofagiit;Acute esophagitis (disorder);;0;19.12.2016;;;Eesti Patoloogide Selts;1;;
448484002;;Äigeartefakt;Artifact due to smearing (finding);;0;19.12.2016;;;Eesti Patoloogide Selts;1;;
86513005;;Östrogeeni mõju;Estrogen effect (morphologic abnormality);;0;19.12.2016;;;Eesti Patoloogide Selts;1;;
73122003;;Östrogeeni mõju ei esine;No estrogen effect present (morphologic abnormality);;0;19.12.2016;;;Eesti Patoloogide Selts;1;;
74471006;;Östrogeeni mõõdukas mõju;Moderate level estrogen effect present (morphologic abnormality);;0;19.12.2016;;;Eesti Patoloogide Selts;1;;
698601005;;Üksik kaasasündinud väärarend;Single congenital anomaly (disorder);;0;19.12.2016;;;Eesti Patoloogide Selts;1;;
204470001;;Üksik nabaväädiarter;Single umbilical artery (disorder);;0;19.12.2016;;;Eesti Patoloogide Selts;1;;
447058001;;Üksik nekrootiline maksasõlm;Solitary necrotic nodule of liver (disorder);;0;19.12.2016;;;Eesti Patoloogide Selts;1;;
66510004;;Ülajäsemete kaasasündinud väärarend;Congenital anomaly of upper limb (disorder);;0;19.12.2016;;;Eesti Patoloogide Selts;1;;
60555002;;Ülitundlikkuse leukotsütoklastiline vaskuliit;Hypersensitivity angiitis (disorder);;0;19.12.2016;;;Eesti Patoloogide Selts;1;;
43296007;;Ümararakuline liposarkoom;Round cell liposarcoma (morphologic abnormality);;0;19.12.2016;31.05.2022;;Eesti Patoloogide Selts;0;Tunnistatud kehtetuks, seda asendab 27849002 Myxoid liposarcoma (morphologic abnormality);
4668009;;Yersinia sp;Genus Yersinia (organism);;0;19.12.2016;;30.09.2019;Eesti Patoloogide Selts;1;Muudetud veerus Nimetus: Yersinia spp. -> Yersinia sp;
123576013;;Yolk-sac tuumor;Yolk sac tumor;;0;19.12.2016;11.09.2017;;Eesti Patoloogide Selts;0;Tunnistatud kehtetuks kuna Kood ja Pikk_nimetus (SNOMED CT FSN) muutus. Uus Kood ja Pikk_nimetus (SNOMED CT FSN) on 404081005 Yolk sac tumor (disorder);
404081005;;Yolk-sac tuumor;Yolk sac tumor (disorder);;0;11.09.2017;;;Eesti Patoloogide Selts;1;Asendab kehtetuks tunnistatud diagnoosi 123576013 Yolk sac tumor;
726545001;;Intestinaalset tüüpi adenoom;Intestinal-type adenoma (morphologic abnormality);;0;11.09.2017;;;Eesti Patoloogide Selts;1;;
732977002;;Adenokartsinoom, mitteintestinaalne tüüp;Non-intestinal type adenocarcinoma (morphologic abnormality);;0;11.09.2017;;;Eesti Patoloogide Selts;1;;
733074001;;Agressiivne papillaarne tuumor;Aggressive papillary tumor (morphologic abnormality);;0;11.09.2017;;29.11.2018;Eesti Patoloogide Selts;1;Korrigeeritud SNOMED CT FSN: Aggressive papillary tumour (morphologic abnormality) -> Aggressive papillary tumor (morphologic abnormality);
734064008;;Sekundaarne dediferentseerunud luusisene ameloblastiline kartsinoom;Secondary dedifferentiated intraosseous ameloblastic carcinoma (morphologic abnormality);;0;11.09.2017;30.05.2023;;Eesti Patoloogide Selts;0;Tunnistatud kehtetuks, seda asendab 1255214007 Dedifferentiated intraosseous ameloblastic carcinoma (morphologic abnormality);
734063002;;Sekundaarne dediferentseerunud perifeerne ameloblastiline kartsinoom;Secondary dedifferentiated peripheral ameloblastic carcinoma (morphologic abnormality);;0;11.09.2017;30.05.2023;;Eesti Patoloogide Selts;0;Tunnistatud kehtetuks, seda asendab 1255215008 Dedifferentiated peripheral ameloblastic carcinoma (morphologic abnormality);
733414001;;Ameloblastne kartsinoom, primaarne tüüp;Primary ameloblastic carcinoma (morphologic abnormality);;0;11.09.2017;30.05.2023;;Eesti Patoloogide Selts;0;Tunnistatud kehtetuks, seda asendab 1255118000 Ameloblastic carcinoma (morphologic abnormality);
734079001;;Ameloblastoom, soliidne/ multitsüstiline tüüp;Multicystic ameloblastoma (morphologic abnormality);;0;11.09.2017;;;Eesti Patoloogide Selts;1;;
733832005;;Anaplastiline astrotsütoom, IDH-mutantne;Isocitrate dehydrogenase mutant anaplastic astrocytoma (morphologic abnormality);;0;11.09.2017;;;Eesti Patoloogide Selts;1;;
733840004;;Anaplastiline astrotsütoom, IDH-wild-type;Isocitrate dehydrogenase wild-type anaplastic astrocytoma (morphologic abnormality);;0;11.09.2017;;;Eesti Patoloogide Selts;1;;
733843002;;Anaplastiline oligodendroglioom, IDH-mutantne ja 1p/19q-kodeletsiooniga;Anaplastic oligodendroglioma with isocitrate dehydrogenase mutant and 1p/19q-codeleted (morphologic abnormality);;0;11.09.2017;;29.11.2018;Eesti Patoloogide Selts;1;Korrigeeritud SNOMED CT FSN: Anaplastic oligodendroglioma isocitrate dehydrogenase mutant and 1p/19q-codeleted (morphologic abnormality) -> Anaplastic oligodendroglioma with isocitrate dehydrogenase mutant and 1p/19q-codeleted (morphologic abnormality);
733848006;;Anaplastiline pleomorfne ksantoastrotsütoom;Anaplastic pleomorphic xanthoastrocytoma (morphologic abnormality);;0;11.09.2017;;;Eesti Patoloogide Selts;1;;
734044003;;Anaplastiline suurrakklümfoom, ALK positiivne;Anaplastic lymphoma kinase positive anaplastic large cell lymphoma (morphologic abnormality);;0;11.09.2017;;13.12.2018;Eesti Patoloogide Selts;1;Lisatud JSV kood VSR-i jaoks;4- vähk
733850003;;Apoplektiline leiomüoom;Apoplectic leiomyoma (morphologic abnormality);;0;11.09.2017;;;Eesti Patoloogide Selts;1;;
733855008;;Atsinaarrakuline tsüstadenoom;Acinar cell cystadenoma (morphologic abnormality);;0;11.09.2017;;;Eesti Patoloogide Selts;1;;
734083001;;Atüüpiline neurofibroom;Atypical neurofibroma (morphologic abnormality);;0;11.09.2017;;;Eesti Patoloogide Selts;1;;
734142002;;B-rakklümfoom, klassifitseerimatu, difuusse B-suurrakk- ja Burkitti lümfoomi tunnustega;B-cell lymphoma with features intermediate between diffuse large B-cell lymphoma and Burkitt lymphoma (morphologic abnormality);;0;11.09.2017;30.09.2019;13.12.2018;Eesti Patoloogide Selts;0;Tunnistatud kehtetuks, seda asendab 12341000132100 B-cell lymphoma, unclassifiable, with features intermediate between diffuse large B-cell lymphoma and Burkitt lymphoma (morphologic abnormality);4- vähk
733859002;;Dermatofibrosarcoma protuberans, fibrosarkomatoosne;Fibrosarcomatous dermatofibrosarcoma protuberans (morphologic abnormality);;0;11.09.2017;;;Eesti Patoloogide Selts;1;;
733862004;;Difuusne keskjoone glioom, H3 K27M-mutantne;Diffuse midline glioma, point mutation K27M in histone H3 (morphologic abnormality);;0;11.09.2017;;30.05.2023;Eesti Patoloogide Selts;1;Muudetud eestikeelset nimetust: Diffuusne keskjoone glioom, H3 K37M-mutantne -> Difuusne keskjoone glioom, H3 K27M-mutantne;
733841000;;Difuusne astrostüstoom, IDH-wild-type;Isocitrate dehydrogenase wild-type diffuse astrocytoma (morphologic abnormality);;0;11.09.2017;;;Eesti Patoloogide Selts;1;;
733842007;;Difuusne astrotsütoom, IDH-mutantne;Isocitrate dehydrogenase mutant diffuse astrocytoma (morphologic abnormality);;0;11.09.2017;;;Eesti Patoloogide Selts;1;;
733868000;;Ependümoom, RELA fusioon-positiivne;RELA fusion-positive ependymoma (morphologic abnormality);;0;11.09.2017;;;Eesti Patoloogide Selts;1;;
733836008;;Epitelioidne angiomüolipoom;Epithelioid angiomyolipoma (morphologic abnormality);;0;11.09.2017;;;Eesti Patoloogide Selts;1;;
733837004;;Epitelioidne glioblastoom;Epithelioid glioblastoma (morphologic abnormality);;0;11.09.2017;;;Eesti Patoloogide Selts;1;;
733875004;;Fibromatoosisarnane metaplastiline kartsinoom;Fibromatosis-like metaplastic carcinoma (morphologic abnormality);;0;11.09.2017;;;Eesti Patoloogide Selts;1;;
733891001;;Gemistotsütaarne astrotsütoom, IDH-mutantne;Gemistocytic astrocytoma isocitrate dehydrogenase mutation (morphologic abnormality);;0;11.09.2017;;;Eesti Patoloogide Selts;1;;
733888001;;Glioblastoom, IDH-mutantne;Glioblastoma isocitrate dehydrogenase 1 mutation (morphologic abnormality);;0;11.09.2017;;;Eesti Patoloogide Selts;1;;
733889009;;Glioblastoom, IDH-wild-type;Glioblastoma isocitrate dehydrogenase wildtype (morphologic abnormality);;0;11.09.2017;;20.03.2018;Eesti Patoloogide Selts;1;Korrigeeritud eestikeelset nimetust (lisatud mõttekriips);
734014001;;Heledarakuline papillaarne neerurakuline kartsinoom;Clear cell papillary renal cell carcinoma (morphologic abnormality);;0;11.09.2017;;;Eesti Patoloogide Selts;1;;
254915003;;Heledarakuline neerurakuline kartsinoom;Clear cell carcinoma of kidney (disorder);;0;11.09.2017;;;Eesti Patoloogide Selts;1;;
734032001;;Heledarakuline odontogeenne kartsinoom;Clear cell odontogenic carcinoma (morphologic abnormality);;0;11.09.2017;;;Eesti Patoloogide Selts;1;;
734033006;;Hepatoblastoom, segatüüpi epiteliaalne-mesenhümaalne;Mixed epithelial-mesenchymal hepatoblastoma (morphologic abnormality);;0;11.09.2017;;;Eesti Patoloogide Selts;1;;
734035004;;Hepatoblastoom, epteliaalne variant;Epithelial variant hepatoblastoma (morphologic abnormality);;0;11.09.2017;;;Eesti Patoloogide Selts;1;;
734036003;;Hulgitsüstiline neerutuumor, madalmaliigne;Multilocular cystic renal cell neoplasm of low malignant potential (morphologic abnormality);;0;11.09.2017;;;Eesti Patoloogide Selts;1;;
734037007;;Ektoopiline hüpofüsaarne adenoom;Ectopic pituitary adenoma (morphologic abnormality);;0;11.09.2017;;;Eesti Patoloogide Selts;1;;
734070002;;Idurakuline tuumor hematoloogilise pahaloomulise kasvajaga;Germ cell neoplasm with hematological malignancy (morphologic abnormality);;0;11.09.2017;;;Eesti Patoloogide Selts;1;;
734071003;;Idurakuline tuumor somaatilise pahaloomulise soliidkasvajaga;Germ cell neoplasm with somatic-type solid malignancy (morphologic abnormality);;0;11.09.2017;;;Eesti Patoloogide Selts;1;;
722958008;;Infektsioosse mononukleoosi laadne siirdamisjärgne lümfoproliferatiivne haigus;Infectious mononucleosis-like post-transplant lymphoproliferative disorder (disorder);;0;11.09.2017;;;Eesti Patoloogide Selts;1;;
734075007;;Intraduktaalne papillaarne neoplaasia invasiivse kartsinoomiga;Intraductal papillary neoplasm with invasive carcinoma (morphologic abnormality);;0;11.09.2017;;28.04.2020;Eesti Patoloogide Selts;1;Muudetud eestikeelne nimetus: Intraduktaalne papillaarne kasvaja invasiivse kartsinoomiga-> Intraduktaalne papillaarne neoplaasia invasiivse kartsinoomiga;
734038002;;Intrapulmonaalne tümoom;Intrapulmonary thymoma (morphologic abnormality);;0;11.09.2017;;;Eesti Patoloogide Selts;1;;
