403455006;;Keele traumaatiline ultseratiivne granuloom strooma eosinofiiliaga;Traumatic ulcerative granuloma of tongue with stromal eosinophilia (disorder);;0;19.12.2016;;;Eesti Patoloogide Selts;1;;
36151004;;Keemiline ösofagiit;Chemical esophagitis (disorder);;0;19.12.2016;;;Eesti Patoloogide Selts;1;;
58405006;;Keloid;Keloid (morphologic abnormality);;0;19.12.2016;;;Eesti Patoloogide Selts;1;;
41704900;;Keratoakantoom;Localized keratoacanthoma (morphologic abnormality);;0;19.12.2016;11.09.2017;;Eesti Patoloogide Selts;0;Tunnistatud kehtetuks kuna oli vigane Kood. Lisatud sama diagnoos uue, korrektse koodiga 417049003.;
417049003;;Keratoakantoom;Localized keratoacanthoma (morphologic abnormality);;0;11.09.2017;;;Eesti Patoloogide Selts;1;Asendab vigase koodiga 41704900 diagnoosi.;
95269005;;Keratoos huuletubakast;Smokeless tobacco keratosis (disorder);;0;19.12.2016;;;Eesti Patoloogide Selts;1;;
399547009;;Keratootiline basaalrakuline kartsinoom;Keratotic basal cell carcinoma (morphologic abnormality);;0;19.12.2016;;;Eesti Patoloogide Selts;1;;
55006001;;Kerge ahela nefropaatia;Light chain nephropathy (disorder);;0;19.12.2016;;;Eesti Patoloogide Selts;1;;
43185009;;Kerge düsplaasia;Mild dysplasia (morphologic abnormality);;0;19.12.2016;;;Eesti Patoloogide Selts;1;;2- limaskesta low-grade neoplaasia
88948004;;Kerge näärmeepiteeli rakkude atüüpia;Mild glandular cell atypia (morphologic abnormality);;0;19.12.2016;;13.12.2018;Eesti Patoloogide Selts;1;Lisatud JSV kood VSR-i jaoks;2- limaskesta low-grade neoplaasia
103622007;;Kerge põletik;Mild inflammation (morphologic abnormality);;0;19.12.2016;;;Eesti Patoloogide Selts;1;;1- kasvajat ei ole
43620002;;Kerge põletikuline atüüpia;Mild inflammatory atypia (morphologic abnormality);;0;19.12.2016;;30.09.2019;Eesti Patoloogide Selts;1;Lisatud JSV kood VSR-i jaoks;1- kasvajat ei ole
51206004;;Kerge tsütoloogiline atüüpia;Mild cytologic atypia (morphologic abnormality);;0;19.12.2016;;13.12.2018;Eesti Patoloogide Selts;1;Lisatud JSV kood VSR-i jaoks;2- limaskesta low-grade neoplaasia
73103007;;Keskkõrvapolüüp;Polyp of middle ear (disorder);;0;19.12.2016;;;Eesti Patoloogide Selts;1;;
65363002;;Keskkõrvapõletik;Otitis media (disorder);;0;19.12.2016;;;Eesti Patoloogide Selts;1;;
448736007;;Keskproliferatiivne endomeetrium;Midproliferative endometrium (morphologic abnormality);;0;19.12.2016;;;Eesti Patoloogide Selts;1;;
449165002;;Kesksekretoorne endomeetrium;Midsecretory endometrium (morphologic abnormality);;0;19.12.2016;;;Eesti Patoloogide Selts;1;;
125362005;;Kesktsooni nekroos;Midzonal necrosis (morphologic abnormality);;0;19.12.2016;;;Eesti Patoloogide Selts;1;;
73728008;;Kiirenenud küpsemine;Maturation acceleration (morphologic abnormality);;0;19.12.2016;;;Eesti Patoloogide Selts;1;;
445145001;;Kiiritusest põhjustatud nekroos;Necrosis caused by ionizing radiation (disorder);;0;19.12.2016;;;Eesti Patoloogide Selts;1;;
53222009;;Kiiritusest tingitud reaktiivsed rakulised muutused;Reactive cellular changes associated with radiation (morphologic abnormality);;0;19.12.2016;;;Eesti Patoloogide Selts;1;;
35944002;;Kiiritushaavand;Radiation ulcer (morphologic abnormality);;0;19.12.2016;;;Eesti Patoloogide Selts;1;;
53476006;;Kiiritushepatiit;Radiation hepatitis (disorder);;0;19.12.2016;;;Eesti Patoloogide Selts;1;;
34081008;;Kiiritusjärgsed düsplastilised tsütoloogilised muutused;Post-radiation cytologic changes with dysplasia (morphologic abnormality);;0;19.12.2016;;30.11.2021;Eesti Patoloogide Selts;1;Eemaldatud liigne tühik eestikeelses nimetuses;
24803000;;Kiirituskahjustus;Injury caused by exposure to ionizing radiation (disorder);;0;19.12.2016;;;Eesti Patoloogide Selts;1;;
11251000;;Kiiritustsüstiit;Irradiation cystitis (disorder);;0;19.12.2016;;;Eesti Patoloogide Selts;1;;
235605005;;Kiiritusösofagiit;Radiation esophagitis (disorder);;0;19.12.2016;;;Eesti Patoloogide Selts;1;;
128678000;;Kilpnäärme medullaar-follikulaarne kartsinoom;Mixed medullary-follicular carcinoma (morphologic abnormality);;0;19.12.2016;;;Eesti Patoloogide Selts;1;;
128916007;;Kilpnäärme medullaarne kartsinoom;Medullary carcinoma with amyloid stroma (morphologic abnormality);;0;19.12.2016;;;Eesti Patoloogide Selts;1;;
21279007;;Kilpnäärmekude keeles;Lingual thyroid (disorder);;0;19.12.2016;;;Eesti Patoloogide Selts;1;;
103646000;;Kindlaksmääramata tähendusega atüüpilised endomeetriumi rakud (AGC-NOS);Atypical endometrial cells of undetermined significance (morphologic abnormality);;0;19.12.2016;;;Eesti Patoloogide Selts;1;;
103643008;;Kindlaksmääramata tähendusega atüüpilised endotservikaalsed rakud (AGC-NOS);Atypical endocervical cells of undetermined significance (morphologic abnormality);;0;19.12.2016;;;Eesti Patoloogide Selts;1;;
39035006;;Kindlaksmääramata tähendusega atüüpilised lameepiteeli rakud (ASC-US);Atypical squamous cells of undetermined significance (morphologic abnormality);;0;19.12.2016;;;Eesti Patoloogide Selts;1;;
4476003;;Kindlaksmääramata tähendusega atüüpilised näärmeepiteeli rakud (AGC-NOS);Atypical glandular cells of undetermined significance (morphologic abnormality);;0;19.12.2016;;;Eesti Patoloogide Selts;1;;
103635003;;Kindlaksmääramata tähendusega atüüpilised rakud;Atypical cells of undetermined significance (morphologic abnormality);;0;19.12.2016;;;Eesti Patoloogide Selts;1;;
5050001;;Kirsshemangioom;Senile angioma (disorder);;0;19.12.2016;;;Eesti Patoloogide Selts;1;;
125319009;;Kirurgiline fistul;Surgical fistula (morphologic abnormality);;0;19.12.2016;;;Eesti Patoloogide Selts;1;;
110403003;;Kirurgiline koeimplantaat;Surgical tissue implant (morphologic abnormality);;0;19.12.2016;;;Eesti Patoloogide Selts;1;;
56381008;;Kivi;Calculus (morphologic abnormality);;0;19.12.2016;;;Eesti Patoloogide Selts;1;;1- kasvajat ei ole
66058000;;Kivitõbi;Lithiasis (morphologic abnormality);;0;19.12.2016;;;Eesti Patoloogide Selts;1;;1- kasvajat ei ole
128630000;;Klaasrakuline adenoskvamoosne kartsinoom;Glassy cell carcinoma (morphologic abnormality);;0;19.12.2016;;;Eesti Patoloogide Selts;1;;
699703008;;Klassikaline medulloblastoom;Classic medulloblastoma (morphologic abnormality);;0;19.12.2016;;;Eesti Patoloogide Selts;1;;
6492006;;Klatskini kasvaja;Klatskin's tumor (morphologic abnormality);;0;19.12.2016;;;Eesti Patoloogide Selts;1;;
417443008;;Klebsiella granulomatis;Klebsiella granulomatis (organism);;0;19.12.2016;;;Eesti Patoloogide Selts;1;;
84570003;;Kloakogeenne kartsinoom;Cloacogenic carcinoma (morphologic abnormality);;0;19.12.2016;;;Eesti Patoloogide Selts;1;;4- vähk
32224006;;Koagulatsiooninekroos;Coagulative necrosis (morphologic abnormality);;0;19.12.2016;;;Eesti Patoloogide Selts;1;;
14156004;;Kobaraneurüsm;Racemose aneurysm (morphologic abnormality);;0;19.12.2016;;;Eesti Patoloogide Selts;1;;
405752007;;Kodade vaheseina kaasasündinud defekt;Congenital atrial septal defect (disorder);;0;19.12.2016;;;Eesti Patoloogide Selts;1;;
103681003;;Koeparanemisehäire;Impaired tissue repair (morphologic abnormality);;0;19.12.2016;;;Eesti Patoloogide Selts;1;;
128669006;;Kogumistorukeste kartsinoom;Collecting duct carcinoma (morphologic abnormality);;0;19.12.2016;;;Eesti Patoloogide Selts;1;;
14391000;;Koilotsütaarne atüüpia;Koilocytotic atypia (morphologic abnormality);;0;19.12.2016;;11.09.2017;Eesti Patoloogide Selts;1;Muudetud veerus Nimetus eestikeelset nimetust Koilotsütootiline atüüpia -> Koilotsütaarne atüüpia;
82403002;;Kolangiit;Cholangitis (disorder);;0;19.12.2016;;;Eesti Patoloogide Selts;1;;
370489002;;Kolangiohepatiit;Cholangiohepatitis (disorder);;0;19.12.2016;;;Eesti Patoloogide Selts;1;;
70179006;;Kolangiokartsinoom;Cholangiocarcinoma (morphologic abnormality);;0;19.12.2016;;;Eesti Patoloogide Selts;1;;
125568005;;Koldeline fibromatoos;Focal fibromatosis (morphologic abnormality);;0;19.12.2016;;;Eesti Patoloogide Selts;1;;
55294001;;Koldeline maksanekroos;Focal hepatic necrosis (disorder);;0;19.12.2016;;;Eesti Patoloogide Selts;1;;
52739002;;Koldeline nekroos;Focal necrosis (morphologic abnormality);;0;19.12.2016;;;Eesti Patoloogide Selts;1;;
22995004;;Koldeline nodulaarne hüperplaasia;Focal nodular hyperplasia (morphologic abnormality);;0;19.12.2016;;;Eesti Patoloogide Selts;1;;
125555002;;Koldeline proliferatsioon;Focal proliferation (morphologic abnormality);;0;19.12.2016;;;Eesti Patoloogide Selts;1;;
123630003;;Koldeline äge põletik;Focal acute inflammation (morphologic abnormality);;0;19.12.2016;;;Eesti Patoloogide Selts;1;;1- kasvajat ei ole
33688009;;Kolestaas;Cholestasis (finding);;0;19.12.2016;;;Eesti Patoloogide Selts;1;;
271440004;;Kolestaasist põhjustatud sekundaarne maksatsirroos;Cirrhosis secondary to cholestasis (disorder);;0;19.12.2016;;;Eesti Patoloogide Selts;1;;
95556007;;Kolestaatiline hepatiit;Cholestatic hepatitis (disorder);;0;19.12.2016;;;Eesti Patoloogide Selts;1;;
575006;;Kolesteatoom;Cholesteatoma (morphologic abnormality);;0;19.12.2016;;;Eesti Patoloogide Selts;1;;
48319001;;Kolesteroloos;Cholesterolosis (morphologic abnormality);;0;19.12.2016;;;Eesti Patoloogide Selts;1;;1- kasvajat ei ole
40487009;;Kolesteroolgranuloom;Cholesterol granuloma (morphologic abnormality);;0;19.12.2016;;;Eesti Patoloogide Selts;1;;1- kasvajat ei ole
46983009;;Kolesteroolpolüüp;Cholesterol polyp (morphologic abnormality);;0;19.12.2016;;;Eesti Patoloogide Selts;1;;1- kasvajat ei ole
268239009;;Kolju ja näoluude kaasasündinud väärarend;Congenital abnormality of skull and face bones (disorder);;0;19.12.2016;;;Eesti Patoloogide Selts;1;;
447298005;;Kollageenne sferuloos;Collagenous spherulosis (morphologic abnormality);;0;19.12.2016;;;Eesti Patoloogide Selts;1;;
19311003;;Kollagenoosne koliit;Collagenous colitis (disorder);;0;19.12.2016;;30.09.2019;Eesti Patoloogide Selts;1;Lisatud JSV kood VSR-i jaoks;1- kasvajat ei ole
386762009;;Kollaskeha tsüst;Corpus luteum cyst (disorder);;0;19.12.2016;;;Eesti Patoloogide Selts;1;;
82508008;;Kollikvatsioonnekroos;Liquefactive necrosis (morphologic abnormality);;0;19.12.2016;;;Eesti Patoloogide Selts;1;;
120426010;;Kolloidne adenokartsinoom;Colloid carcinoma;;0;19.12.2016;28.04.2020;;Eesti Patoloogide Selts;0;Tunnistatud kehtetuks, seda asendab 471000181105 Colloid adenocarcinoma (morphologic abnormality);
9287005;;Kolloidtsüst;Colloid cyst (morphologic abnormality);;0;19.12.2016;;;Eesti Patoloogide Selts;1;;
128789002;;Kordoidglioom;Chordoid glioma (morphologic abnormality);;0;19.12.2016;;30.05.2023;Eesti Patoloogide Selts;1;Muudetud eestikeelset nimetust:  Kolmanda vatsakese kordoidglioom -> Kordoidglioom;
52178006;;Kombineeritud maksarakuline ja kolangiokartsinoom;Combined hepatocellular carcinoma and cholangiocarcinoma (morphologic abnormality);;0;19.12.2016;;;Eesti Patoloogide Selts;1;;
402552003;;Kombineeritud neevus;Combined melanocytic nevus (disorder);;0;19.12.2016;;;Eesti Patoloogide Selts;1;;
448546006;;Kombineeritud suurerakuline neuroendokriinne kartsinoom;Combined large cell neuroendocrine carcinoma (morphologic abnormality);;0;19.12.2016;;;Eesti Patoloogide Selts;1;;
21326004;;Kombineeritud väikserakuline kartsinoom;Combined small cell carcinoma (morphologic abnormality);;0;19.12.2016;;;Eesti Patoloogide Selts;1;;
74584000;;Kompensatoorne regeneratsioon;Compensatory regeneration (morphologic abnormality);;0;19.12.2016;;;Eesti Patoloogide Selts;1;;
29020002;;Kompleksne odontoom;Complex odontoma (morphologic abnormality);;0;19.12.2016;;;Eesti Patoloogide Selts;1;;
703660008;;Komposiithemangioendotelioom;Composite hemangioendothelioma (morphologic abnormality);;0;19.12.2016;;;Eesti Patoloogide Selts;1;;
76312009;;Kondroblastne osteosarkoom;Chondroblastic osteosarcoma (morphologic abnormality);;0;19.12.2016;;;Eesti Patoloogide Selts;1;;
9001003;;Kondroblastoom;Chondroblastoma (morphologic abnormality);;0;19.12.2016;;;Eesti Patoloogide Selts;1;;
74279005;;Kondroblastoom, pahaloomuline;Chondroblastoma, malignant (morphologic abnormality);;0;19.12.2016;;;Eesti Patoloogide Selts;1;;
63198006;;Kondromalaatsia;Chondromalacia (disorder);;0;19.12.2016;;;Eesti Patoloogide Selts;1;;
83944004;;Kondromatoos;Chondromatosis (morphologic abnormality);;0;19.12.2016;;;Eesti Patoloogide Selts;1;;
39553005;;Kondromüksoidne fibroom;Chondromyxoid fibroma (morphologic abnormality);;0;19.12.2016;;;Eesti Patoloogide Selts;1;;
31186001;;Kondroom;Chondroma (morphologic abnormality);;0;19.12.2016;;;Eesti Patoloogide Selts;1;;
14990007;;Kondrosarkoom;Chondrosarcoma, no International Classification of Diseases for Oncology subtype (morphologic abnormality);;0;19.12.2016;31.05.2022;29.11.2018;Eesti Patoloogide Selts;0;Tunnistatud kehtetuks, seda asendab 1163016002 Chondrosarcoma (morphologic abnormality);
703699000;;Kondrosarkoom, G2;Chondrosarcoma, grade 2 (morphologic abnormality);;0;19.12.2016;;;Eesti Patoloogide Selts;1;;
703700004;;Kondrosarkoom, G3;Chondrosarcoma, grade 3 (morphologic abnormality);;0;19.12.2016;;;Eesti Patoloogide Selts;1;;
19672005;;Kondüloom;Condyloma (morphologic abnormality);;0;19.12.2016;;;Eesti Patoloogide Selts;1;;
77593006;;Kongenitaalne bronhiektaasia;Congenital bronchiectasis (disorder);;0;19.12.2016;;;Eesti Patoloogide Selts;1;;
128740007;;Kongenitaalne peribronhiaalne müofibroblastne kasvaja;Myofibroblastic tumor, peribronchial (morphologic abnormality);;0;19.12.2016;;;Eesti Patoloogide Selts;1;;
128733006;;Proliferatiivne sõlm kongenitaalses neevuses;Proliferative dermal lesion in congenital nevus (morphologic abnormality);;0;19.12.2016;;30.09.2019;Eesti Patoloogide Selts;1;Muudetud veerus nimetus: Kongenitaalse neevuse dermaalne proliferatiivne lesioon -> Proliferatiivne sõlm kongenitaalses neevuses;
19058002;;Kongestiivne splenomegaalia;Congestive splenomegaly (disorder);;0;19.12.2016;;;Eesti Patoloogide Selts;1;;
195738009;;Konstriktiivne bronhioliit;Obliterating fibrous bronchiolitis (disorder) ;;0;19.12.2016;20.03.2018;;Eesti Patoloogide Selts;0;Tunnistatud kehtetuks SNOMED-i 31.01.2018 rahvusvahelises versioonis. Asenduseks on diagnoos 40100001 Konstriktiivne bronhioliit;
40100001;;Konstriktiivne bronhioliit;Obliterative bronchiolitis (disorder);;0;20.03.2018;;;Eesti Patoloogide Selts;1;;
57048009;;Kontraktuur;Contracture (morphologic abnormality);;0;19.12.2016;;;Eesti Patoloogide Selts;1;;
44769000;;Koorionkartsinoom;Choriocarcinoma, no International Classification of Diseases for Oncology subtype (morphologic abnormality);;0;19.12.2016;30.11.2021;29.11.2018;Eesti Patoloogide Selts;0;Tunnistatud kehtetuks, seda asendab 1156971005 Choriocarcinoma (morphologic abnormality);
87153008;;Kopsu alveolaarne mikrolitiaas;Pulmonary alveolar microlithiasis (disorder);;0;19.12.2016;;;Eesti Patoloogide Selts;1;;
10501004;;Kopsu alveolaarne proteinoos;Pulmonary alveolar proteinosis (disorder);;0;19.12.2016;;;Eesti Patoloogide Selts;1;;
196135008;;Kopsu amüloidoos;Pulmonary amyloidosis (disorder);;0;19.12.2016;;;Eesti Patoloogide Selts;1;;
11399002;;Kopsu arteriaalne hüpertensioon;Pulmonary hypertensive arterial disease (disorder);;0;19.12.2016;;;Eesti Patoloogide Selts;1;;
278976004;;Kopsu bulla;Bulla of lung (finding);;0;19.12.2016;;;Eesti Patoloogide Selts;1;;
707551007;;Kopsu interstitsiaalne glükogenoos;Pulmonary interstitial glycogenosis (disorder);;0;19.12.2016;;;Eesti Patoloogide Selts;1;;
18620009;;Kopsu kaasasündinud sekvestratsioon;Congenital sequestration of lung (disorder);;0;19.12.2016;;;Eesti Patoloogide Selts;1;;
47147007;;Kopsu kaasasündinud väärarend;Congenital anomaly of lung (disorder);;0;19.12.2016;;;Eesti Patoloogide Selts;1;;
233949008;;Kopsu kapillaarne hemangiomatoos;Pulmonary capillary hemangiomatosis (disorder);;0;19.12.2016;;;Eesti Patoloogide Selts;1;;
417152008;;Kopsu Langerhansi-rakuline histiotsütoos;Langerhans cell histiocytosis of lung (disorder);;0;19.12.2016;;;Eesti Patoloogide Selts;1;;
89420002;;Kopsu veno-oklusiivne haigus;Pulmonary veno-occlusive disease (disorder);;0;19.12.2016;;;Eesti Patoloogide Selts;1;;
5499009;;Kopsu venoosne hüpertensioon;Pulmonary hypertensive venous disease (disorder);;0;19.12.2016;;;Eesti Patoloogide Selts;1;;
36110001;;Kopsuarterite kaasasündinud väärarend;Congenital anomaly of pulmonary artery (disorder);;0;19.12.2016;;;Eesti Patoloogide Selts;1;;
43149009;;Kopsublastoom;Pulmonary blastoma (morphologic abnormality);;0;19.12.2016;;;Eesti Patoloogide Selts;1;;
111322000;;Kopsuveenide kaasasündinud väärarend;Congenital anomaly of pulmonary veins (disorder);;0;19.12.2016;;;Eesti Patoloogide Selts;1;;
699948001;;Korangioom;Chorangioma (morphologic abnormality);;0;19.12.2016;;;Eesti Patoloogide Selts;1;;
50007008;;Kordoom;Chordoma (morphologic abnormality);;0;19.12.2016;;;Eesti Patoloogide Selts;1;;
128904001;;Koroidpleksuse atüüpiline papilloom;Atypical choroid plexus papilloma (morphologic abnormality);;0;19.12.2016;;30.11.2021;Eesti Patoloogide Selts;1;Muudetud nimetust: Korioidpleksuse atüüpiline papilloom -> Koroidpleksuse atüüpiline papilloom;
88252006;;Koroidpleksuse kartsinoom;Choroid plexus carcinoma (morphologic abnormality);;0;19.12.2016;;30.11.2021;Eesti Patoloogide Selts;1;Muudetud nimetust: Korioidpleksuse kartsinoom - > Koroidpleksuse kartsinoom;
18021007;;Korioidpleksuse papilloom;Choroid plexus papilloma, no International Classification of Diseases for Oncology subtype (morphologic abnormality);;0;19.12.2016;30.11.2021;29.11.2018;Eesti Patoloogide Selts;0;Tunnistatud kehtetuks, seda asendab 1156641000 Benign choroid plexus papilloma (morphologic abnormality);
417338002;;Koristoom;Choristoma (morphologic abnormality);;0;19.12.2016;;;Eesti Patoloogide Selts;1;;
253082002;;Koroidne meningioom;Choroid meningioma (morphologic abnormality);;0;19.12.2016;31.05.2021;;Eesti Patoloogide Selts;0;Tunnistatud kehtetuks, seda asendab 399709001 Meningioma, chordoid (morphologic abnormality);
103427014;;Korrapärane epiteeli proliferatsioon;Regular epithelial proliferation;;0;19.12.2016;30.09.2019;;Eesti Patoloogide Selts;0;;
53565009;;Kortsunud tuum;Wrinkled nucleus (morphologic abnormality);;0;19.12.2016;;;Eesti Patoloogide Selts;1;;
54002007;;Kotjas aneurüsm;Saccular aneurysm (morphologic abnormality);;0;19.12.2016;;;Eesti Patoloogide Selts;1;;
40009002;;Kraniofarüngioom;Craniopharyngioma (morphologic abnormality);;0;19.12.2016;;;Eesti Patoloogide Selts;1;;
30156004;;Kribriformne kartsinoom;Cribriform carcinoma (morphologic abnormality);;0;19.12.2016;;30.09.2019;Eesti Patoloogide Selts;1;Muudetud veerus nimetus: Kribriformne adenokartsinoom -> Kribriformne kartsinoom;
37039006;;Kromofoobne adenoom;Chromophobe adenoma (morphologic abnormality);;0;19.12.2016;;;Eesti Patoloogide Selts;1;;
1443001;;Kromofoobne kartsinoom;Chromophobe carcinoma (morphologic abnormality);;0;19.12.2016;;;Eesti Patoloogide Selts;1;;
128667008;;Kromofoobne neerurakuline kartsinoom;Renal cell carcinoma, chromophobe cell (morphologic abnormality);;0;19.12.2016;;;Eesti Patoloogide Selts;1;;
79203009;;Krooniline abstsess;Chronic abscess (morphologic abnormality);;0;19.12.2016;;;Eesti Patoloogide Selts;1;;1- kasvajat ei ole
1116000;;Krooniline agressiivne B-hepatiit;Chronic aggressive type B viral hepatitis (disorder);;0;19.12.2016;;;Eesti Patoloogide Selts;1;;
89789003;;Krooniline agressiivne viirushepatiit;Chronic aggressive viral hepatitis (disorder);;0;19.12.2016;;;Eesti Patoloogide Selts;1;;
50167007;;Krooniline aktiivne B-hepatiit;Chronic active type B viral hepatitis (disorder);;0;19.12.2016;;30.11.2021;Eesti Patoloogide Selts;1;Eemaldatud üleliigne tühik eestikeelses nimetuses;
702716009;;Krooniline aktiivne endometriit;Acute on chronic endometritis (disorder);;0;19.12.2016;;;Eesti Patoloogide Selts;1;;
396337009;;Krooniline aktiivne gastriit;Acute and chronic gastritis (disorder);;0;19.12.2016;;;Eesti Patoloogide Selts;1;;
197284004;;Krooniline aktiivne hepatiit;Chronic active hepatitis (disorder);;0;19.12.2016;;;Eesti Patoloogide Selts;1;;
396335001;;Krooniline aktiivne koletsüstiit;Acute and chronic cholecystitis (disorder);;0;19.12.2016;;;Eesti Patoloogide Selts;1;;
396336000;;Krooniline aktiivne koliit;Acute and chronic colitis (disorder);;0;19.12.2016;;30.09.2019;Eesti Patoloogide Selts;1;Lisatud JSV kood VSR-i jaoks;1- kasvajat ei ole
702715008;;Krooniline aktiivne prostatiit;Acute on chronic prostatitis (disorder);;0;19.12.2016;;;Eesti Patoloogide Selts;1;;
75889009;;Krooniline aktiivne põletik;Acute and chronic inflammation (morphologic abnormality);;0;19.12.2016;;;Eesti Patoloogide Selts;1;;1- kasvajat ei ole
70120007;;Krooniline aktiivne salpingiit;Subacute salpingitis (disorder);;0;19.12.2016;;;Eesti Patoloogide Selts;1;;
702714007;;Krooniline aktiivne sialoadeniit;Acute on chronic sialoadenitis (disorder);;0;19.12.2016;;;Eesti Patoloogide Selts;1;;
702717000;;Krooniline aktiivne tservitsiit;Acute on chronic cervicitis (disorder);;0;19.12.2016;;;Eesti Patoloogide Selts;1;;
66870002;;Krooniline aktiivne viirushepatiit;Chronic active viral hepatitis (disorder);;0;19.12.2016;;;Eesti Patoloogide Selts;1;;
307757001;;Krooniline alkohoolne hepatiit;Chronic alcoholic hepatitis (disorder);;0;19.12.2016;;;Eesti Patoloogide Selts;1;;
713181003;;Krooniline alkohoolne maksahaigus;Chronic alcoholic liver disease (disorder);;0;19.12.2016;;;Eesti Patoloogide Selts;1;;
235952002;;Krooniline alkohoolne pankreatiit;Alcohol-induced chronic pancreatitis (disorder);;0;19.12.2016;;;Eesti Patoloogide Selts;1;;
140221013;;Krooniline atroofiline gastriit;Chronic atrophic gastritis;;0;19.12.2016;30.09.2019;;Eesti Patoloogide Selts;0;Tunnistatud kehtetuks, seda asendab 8493009 Chronic gastritis (disorder);
109299008;;Krooniline bursiit;Chronic bursitis (disorder);;0;19.12.2016;;;Eesti Patoloogide Selts;1;;
128302006;;Krooniline C-hepatiit;Chronic hepatitis C (disorder);;0;19.12.2016;;;Eesti Patoloogide Selts;1;;
708198006;;Krooniline C-hepatiit, maksa fibroosi staadium 1;Chronic active hepatitis C (disorder);;0;19.12.2016;;;Eesti Patoloogide Selts;1;;
703866000;;Krooniline C-hepatiit, maksa fibroosi staadium 2;Chronic hepatitis C with stage 2 fibrosis (disorder);;0;19.12.2016;;;Eesti Patoloogide Selts;1;;
347891000119103;;Krooniline C-hepatiit, maksa fibroosi staadium 3;Chronic hepatitis C with stage 3 fibrosis (disorder);;0;19.12.2016;;;Eesti Patoloogide Selts;1;;
831000119103;;Krooniline C-hepatiit, maksa fibroosi staadium 4;Cirrhosis of liver due to chronic hepatitis C (disorder);;0;19.12.2016;;;Eesti Patoloogide Selts;1;;
4760008;;Krooniline dakrüadeniit;Chronic dacryoadenitis (disorder);;0;19.12.2016;;;Eesti Patoloogide Selts;1;;
34936007;;Krooniline dermatiit;Chronic dermatitis (disorder);;0;19.12.2016;;;Eesti Patoloogide Selts;1;;
125334003;;Krooniline deskvamatiivne põletik;Chronic desquamative inflammation (morphologic abnormality);;0;19.12.2016;;;Eesti Patoloogide Selts;1;;1- kasvajat ei ole
110435003;;Krooniline destruktiivne põletik;Chronic destructive inflammation (morphologic abnormality);;0;19.12.2016;;;Eesti Patoloogide Selts;1;;1- kasvajat ei ole
235693007;;Krooniline duodeniit;Chronic duodenitis (disorder);;0;19.12.2016;;;Eesti Patoloogide Selts;1;;
55715000;;Krooniline eksudatiivne põletik;Chronic exudative inflammation (morphologic abnormality);;0;19.12.2016;;;Eesti Patoloogide Selts;1;;1- kasvajat ei ole
63922003;;Krooniline endometriit;Chronic endometritis (disorder);;0;19.12.2016;;;Eesti Patoloogide Selts;1;;
413836008;;Krooniline eosinofiilne leukeemia, täpsustamata;Chronic eosinophilic leukemia (morphologic abnormality);;0;19.12.2016;;;Eesti Patoloogide Selts;1;;
16759001;;Krooniline eosinofiilne põletik;Chronic eosinophilic inflammation (morphologic abnormality);;0;19.12.2016;;;Eesti Patoloogide Selts;1;;1- kasvajat ei ole
1454006;;Krooniline fibrinoosne põletik;Chronic fibrinous inflammation (morphologic abnormality);;0;19.12.2016;;;Eesti Patoloogide Selts;1;;1- kasvajat ei ole
74973004;;Krooniline fibroseeruv pankreatiit;Chronic fibrosing pancreatitis (disorder);;0;19.12.2016;;;Eesti Patoloogide Selts;1;;
235660003;;Krooniline follikulaarne gastriit;Chronic follicular gastritis (disorder);;0;19.12.2016;;;Eesti Patoloogide Selts;1;;
8493009;;Krooniline gastriit;Chronic gastritis (disorder);;0;19.12.2016;;;Eesti Patoloogide Selts;1;;
72621003;;Krooniline gingiviit;Chronic gingivitis (disorder);;0;19.12.2016;;;Eesti Patoloogide Selts;1;;
235662006;;Krooniline granulomatoosne gastriit;Chronic granulomatous gastritis (disorder);;0;19.12.2016;;;Eesti Patoloogide Selts;1;;
405719001;;Krooniline haavand;Chronic ulcer (morphologic abnormality);;0;19.12.2016;;;Eesti Patoloogide Selts;1;;
62814004;;Krooniline haavanduv põletik;Chronic ulcerative inflammation (morphologic abnormality);;0;19.12.2016;;;Eesti Patoloogide Selts;1;;1- kasvajat ei ole
49100009;;Krooniline hemorraagiline põletik;Chronic hemorrhagic inflammation (morphologic abnormality);;0;19.12.2016;;;Eesti Patoloogide Selts;1;;1- kasvajat ei ole
76783007;;Krooniline hepatiit;Chronic hepatitis (disorder);;0;19.12.2016;;;Eesti Patoloogide Selts;1;;
195813006;;Krooniline hüperplastiline larüngiit;Chronic hyperplastic laryngitis (disorder);;0;19.12.2016;;;Eesti Patoloogide Selts;1;;
123733009;;Krooniline kiiritushaavand;Chronic radiation ulcer (morphologic abnormality);;0;19.12.2016;;;Eesti Patoloogide Selts;1;;
71912000;;Krooniline kolangiit;Chronic cholangitis (disorder);;0;19.12.2016;;;Eesti Patoloogide Selts;1;;
20824003;;Krooniline koletsüstiit;Chronic cholecystitis (disorder);;0;19.12.2016;;20.03.2018;Eesti Patoloogide Selts;1;Korrigeeritud eestikeelset nimetust;
29951006;;Krooniline larüngiit;Chronic laryngitis (disorder);;0;19.12.2016;;;Eesti Patoloogide Selts;1;;
20369000;;Krooniline limane põletik;Chronic mucous inflammation (morphologic abnormality);;0;19.12.2016;;;Eesti Patoloogide Selts;1;;1- kasvajat ei ole
57339008;;Krooniline lobulaarne hepatiit;Chronic lobular hepatitis (disorder);;0;19.12.2016;;;Eesti Patoloogide Selts;1;;
301009006;;Krooniline lubjastuv pankreatiit;Calcific chronic pancreatitis (disorder);;0;19.12.2016;;;Eesti Patoloogide Selts;1;;
